Name,Contacts,Address,Comments/ Progress,,,
Total Events – Best Event Management Company in Pune,083291 79995,http://www.totalevents.in/,Spoke to Sapna - to ,,,Address
EVEPRO,093701 82537,https://www.eveproindia.com/,,,,​ Dangat Industrial Estate ​ Sr.No 2/3/4 Near Mumbai- Bangalore Highway Bridge ​Beside Dhone Wada Restaurant
Foxfire Events & Activations Pvt Ltd.,089992 81958,http://www.foxfireofficial.com/,,,,"Aurora Towers, 225,2nd Floor, Sterling Center, MG Road, opposite Hotel"
Urban Events - Best Event Planners in Pune,073504 09292,http://urbanevents.co.in/,,,,"C-1 Building, 1st Floor, Office No.2, Bramha Estate, NIBM Rd, Next to Jyoti Hotel"
Lotus Events and Productions,098222 28505,http://www.lotusep.in/,,,,"Chhajed Glory, near Axis Bank"
Hummingbirds Event Management Pune - Mumbai,083085 99001,,,,,"Office No-9, Mudra Commercials, Pune - Satara Rd, above PNG Jewellers"
TUTONS EVENT MANAGEMENT COMPANY,092255 22123,http://www.tutons.in/,,,,"OfficeNo 43, Aditya Shagun Mall, Prashan Road"
Absolute Concepts Events And Entertainment Pvt. Ltd. - Best Event Company in Pune,,http://www.absoluteconcepts.in/,,,,"Sai Heritage, Baner - Mahalunge Rd, above Elephant and Company, opposite Kaka Halwai"
Happy Minds Events | Event Management Company In Pune,091300 15801,http://event.org.in/,,,,"Flat no.4 ,3rd Floor, B1/1, Plot No.100, Prabhat Rd, above Ravetkar builder office, near National film archieve of India"
Event Doors | Best Event management company in pune,080809 36285,https://theeventdoors.com/,,,,"13, B - WING 3rd FLOOR NANDAN PRIDE, KARVE CHOWK KOTHRUD"
"Flamingo Events , Pune",088062 76961,https://flamingo-events.ueniweb.com/,,,,"first floor, Narmada Niwas, 4110"
Creature Events Management - Best Event Management in Pune.,072761 63121,,,,,"Somji Heights, Nirmaan Estrella, Chowk"
Panamera Events & Productions,083800 66719,http://www.panamera.co.in/?utm_source=google&utm_medium=wix_google_business_profile&utm_campaign=6643911788692364411,,,,Nilkhanth apartment
Rasik Events,089998 08828,,,,,"Nishigandh Bunglow, D/30, Lane No. 8, opp. Maharaja Complex"
Auspicium Events Pvt. Ltd.,099606 55597,http://www.auspicium.in/,,,,Dhayreshwar temple
Parshwa Events,084466 24061,,,,,"Office No 3, Ground Floor, Shirole House, Peoples Co-operative Bank, near Pune"
Our Vision Events - Event Management Company in Pune | Corporate Event Planner,095031 87188,https://www.ourvision.org.in/,,,,Light House
Fidato Events Pvt. Ltd.,099757 08662,https://fidatoevents.com/index.html,,,,"401, Abhipreet Residency, Pan Card Club Rd"
Hunarsource Consulting Pvt Ltd - Corporate Event Management Company in Pune,,http://www.hunarsource.com/,,,,"Office No. 5th Floor, Anubhuti Apartment, 501, Lane 1"
NIEM The Institute of Event Management,097026 04604,https://www.niemindia.com/,,,,"Office No.310, 3rd Floor, City Space, Survey No. 198/1A, opposite FISERV, near Phoenix Mall"
Happy Moments Event Management I Best Event Management Company in Pune,075582 38809,http://www.happymoments.co.in/,,,,"Main Gate, 202, Mosaik Building, Off FC Rd, above Starbucks"
Shandarr Events | Best Event Management Company in Pune |,094043 90009,,,,,"Ganitai Bunglow, Nr New RTO Office Sector.4, Sant Nagar, Spine Rd"
Eventomaniaa,098234 21864,http://www.eventomaniaa.com/,,,,"flat.no 1106,floor. 11, I- wing, Pristine Pacific Rd"
Kunal Event Management-Event Service in Pune,072761 01398,https://id.vyaparify.com/kunal-events-services,,,,"Kundan Plaza, Bhau Patil Rd, opp. Aundh IT Park"
"Tulza Events - Best Event management company in Kharadi for Birthday Party, Corporate Events, Wedding",099229 10513,http://www.tulzaevents.com/,,,,"Shop no.b/01 nilesh prestiges, kale padal hadapsar, pune-28 Shop no.b/01 nilesh prestiges, 28"
The Perfect Knock Events,093728 22728,http://www.theperfectknock.com/,,,,"Kusum Niwas, Shree Park, Sr No 135/34,, Chandan nagar bypass chowk, Pune-Nagar road,, Next to Chate School."
D Tale CREATRIX | Leading Event Management & Best Wedding Planners in Pune,088883 97597,http://www.dtalecreatrix.com/,,,,"Camp, Pudumjee Park, Dada Chelaram Path"
Vijayshree events | Dance Choreographer in Pune | Sangeet Choreographer | virtual event management,099217 66690,,,,,"Flat No-09, 3rd Floor, Shreeyash Apartment, Appasaheb Kulkarni Path"
Events of Happiness,083060 68866,https://eventsofhappiness.in/,,,,32 common seal hall
MAD EVENTS PROFESSIONAL BALLOON DECORATORS IN PUNE,072491 75011,,,,,"322 / 20 mahatma fulle colony, Shankar Sheth Rd"
Great Events Pune,095116 80677,,,,,·
Sadguru Event,086983 08572,https://www.sadguruevent.com/,,,,near Mitra Mandal colony
"Sphinx Adonis Events | Grand Inauguration Events, Corporate & MICE Events",095884 98571,https://sphinxadonisworld.co.in/,,,,Sinhgad Rd
Sanskruti Event Management,,http://www.sanskrutievent.com/,,,,398
AS ART & EVENT,083084 07973,,,,,"World Of Mother Complex, D-104 Jai Ganesh Vision"
Dynamo Events,070305 78637,http://www.dynamoevents.com/,,,,HOUSE NO 150
NAK EVENTS,098220 72002,http://www.nakevents.com/,,,,"19, Laxminarayan Co-Op Housing Society, Burning Ghat Rd, near Bank Of Maharashtra"
"Sixteen by Sixty-Four Media | Event Management Company in Pune, India | Event Planner",098220 39386,https://16by64.com/,,,,"3rd Floor, Office No 11, Kamala Regency, Sheetal, Dnyaneshwar Paduka Chowk, Fergusson College Rd, opp. Bharat Petroleum and Hotel"
INDIE EVENTS PVT. LTD.,080877 20406,http://www.indie-events.com/,,,,"Shakuntal, 19/1 A, opposite Zudio"
Continuum Advertising & Events,097304 13400,https://continuumevents.in/,,,,·
SAI Events | Balloon Decoration In Pune | Wedding Decoration In Pune,084828 21895,https://youtube.com/@saievent6690?si=A7ultu5fl-uwSRVA,,,,"39/25 lane number 9 Shankar Smruti apartment Lane No 9, Prabhat Rd"
Genesis Inc,099602 85741,http://genesisinc.in/,,,,"govind halwai chowk, 610"
Prince event management,093706 95633,,,,,"207, Connaught Place, Bund Garden Road"
E Factor Event Management,091584 20111,https://efactorevents.in/,,,,·
J&R Events,020 2685 5300,http://www.eventsjackratna.com/,,,,"Shop No. 9, Jijai Plaza, near Eklavya College"
Magickal Moments By Aakshay Parmar,090283 20775,,,,,"CLOVER HEIGHTS, Salunke Vihar Rd"
Festora Event | Wedding & Event Planner Pune,,https://pushkarajgaikwad.github.io/festora/,,,,"1st floor Next to Morbi Sweet's, 37, opp. to Zambre Palace"
ColorKnit Events n Production-Event Management Company in Pune,092711 14024,https://www.colorknitevents.com/,,,,"Acra Maruti Kopra, Vinayak Sagar Building, 214, Shukrawar Peth - Mahatma Gandhi Rd"
Craftworld Events,098203 44426,http://craftworldevents.com/corporate-event-management-company-pune/,,,,"3rd Flr Flat No. 303, Fortune House, S. No. 6/1/10, Baner - Pashan Link Rd"
Q Events and Weddings,098220 39090,https://www.qeventsandweddings.com/,,,,"Chintamani DSK Complex, Shop No.1, 'A Wing, 417, Appa Balwant Chowk, near N.M.V. Junior Highschool"
SnS Events - One of the top Event Management Companies in Pune,078880 10102,http://snsevents.in/,,,,"79/80-1, opposite Solitaire Apartments"
Dream Creations,,https://dreamcreations.org.in/,,,,"Amar Villa, 15/375"
Divine's events and Decorations,077588 90546,https://sydnytech.in/divinesevents,,,,"Shop no -13, Sr no -68, shivkamal developers"
Event Dynamics,020 4006 9552,http://www.eventdynamicsindia.com/,,,,"595, Mahatma Phule Rasta, near S. Gaikwad school"
Encore Events And Promotions,098810 71399,https://www.encore-events.biz/,,,,"office no 29-30, Gulmohar Apartments, 2420, East St, opposite Bombay Garage"
Ivy Events And Management,070661 31994,,,,,"Gulmohar Court, 2, B Ln"
Prabandhan Management Services Pvt Ltd,095791 35693,https://prabandhanindia.com/,,,,"DB's Diamond, 1170-25, Kushabhau Jejurikar Rd"
Dreams Events & Entertainment - Wedding Planner Pune,092702 50500,,,,,"Prabandhan Management Services Pvt Ltd, Office No: 422 Amanora Chambers, Mall, behind Amanora"
Puneri decorations & event management,080806 60787,https://www.punerigifts.in/,,,,"hop No. 74-G,Ground, Hotel, Sterling Centre, MG Road, opp. Aurora Towers"
MAHAKAL EVENT'S PUNE,,,,,,"Office No 24, Mandot Tower, Gangadham - Shatrunjay Rd, opposite to Shri Shanti Nagar Society"
MAHAKAL EVENT'S PUNE,,,,,,"Trimurti Datta Mandir, golandas Chowk"
Payal Events,,,,,,"Trimurti Datta Mandir, golandas Chowk"
Siddhivinayak Art & Events,084460 02929,,,,,"Payal Events, 177"
Swarajya Events - Best Event Planners in Pune,097663 59075,,,,,·
Busy Bee Event Promoters,099232 59521,http://busybeeeventpromoters.blogspot.in/,,,,Kranti Park
Dynamic Entertainment | Bespoke Wedding Planners & Decors in Pune | Event Management,097641 43890,,,,,"Popular Heights III, Lane D"
Vinod Pawar Group & Event,084217 77765,,,,,"Second floor, Sanas Residency, Lane No. 6"
Event Management Company,080877 42000,https://events.clicksin.com/,,,,"Ghorpadi Gaon Community Hall Complex, Ln no 1sharavati Nagar"
"BLUE DIVINE MEDIA & EVENTS, A TRUSTED EVENT MANAGEMENT COMPANY.",095959 10066,,,,,"101c, Akshay Complex, Jangali Maharaj Rd, behind Titan"
JS EVENT DECORATORS PUNE,083902 05024,,,,,"Traffic Signal, NP Lifestyle, Nirman Greens Building, office Num - 2, Old Mumbai Pune Higway Before Union Bank of India &"
ROYAL TOUCH EVENTS,,,,,,"office oop, balasaheb bhamre, 113/5 a, Pune - Satara Rd"
bubble show pune,088060 06552,,,,,"New modikhana kumbhar bawdi,Pune .411048"
Saifan-Shadi ki taiyari-Best Wedding Planners and Destination wedding in pune and lonavala - wedding management,090229 56909,https://www.instagram.com/wedding_irishevents?igsh=MWZtOWxqMmhtMHpndg==,,,,·
Entre Nous Experiences Pvt. Ltd.,020 2615 4784,http://www.entrenouseventcreators.com/,,,,"47/A, Satara Rd, near bapkar petrol pump, opp. City Pride"
Relive Management,080871 94011,https://www.relivemanagement.com/,,,,"Liberty Apartments, Phase 1, Flat B-1, 1st Floor, Noth Main Road, Lane No. 6"
Pegasus Events and Convention Services,020 2613 0339,,,,,"Gangotri complex, 927, Synagogue St, near Geeta Society"
Rainbow Events & Tours -- रेनबो इव्हेंट्स आणि टूर्स,089990 83646,https://rainbowtourspune.wixsite.com/rainbow,,,,"Liberty, E-1, N Main Rd, below Central Bank"
J.J Event - Dohale Jevan Decorators in Pune| Birthday Party Decorators | Naming Ceremony Decoratord,098818 19195,,,,,"Flat No-304, Shreyas Clementine, Deccan College Rd"
Ovi Pro Events - Event Management & Planner Company in Pune,,,,,,b29/16
Dynamic Entertainment | Bespoke Wedding Planners & Decors in Pune | Event Management,,,,,,"2nd floor, Kamal Darshan housing Society, Flat no, A-15, Pune-46, behind Khandoba Mandir Road"
Myra event Decoration Pune,087935 66771,,,,,"Second floor, Sanas Residency, Koregaon Rd"
Linkin Minds,085509 36006,http://www.linkinminds.com/,,,,"8, Bibwewadi Kondhwa Rd, behind 59"
Ak Events :-Baby shower Decoration in pune | Naming cermony Decoration in pune |Munj Decoration in pune |,093702 40791,http://www.akeventspune.com/,,,,"3rd Floor,Prem Corner,, Opp Balaji Petrol Pump"
Yours Truly - Corporate Event Planner in Pune,098232 87008,https://yourstruly.events/,,,,"Lane no 4, Hadapsar"
S K EVENT AND DECORE,075586 03641,,,,,"Anand Apartment, Flat No 5, Lane 9, 3"
Poona Event Management Inc.,087935 83134,http://poonaeventmanagement.com/PEMS/,,,,"Shimpi Ali, 1204, MG Road"
ECO- The Event Company,098222 62521,https://www.theeventco.in/,,,,"Mahibub Manzil, 148/51, Anand Path, opposite Dhanwantri Hospital"
SR Events management Pune,,,,,,"The Poona Club Shop,The Poona Club Ltd.6, Bun Garden Road"
OG EVENTS AND DECORATIONS,096996 20925,https://www.instagram.com/og__events00,,,,12
Deeplaxmi Events | Barat on Wheels | Vintage Car,086056 22211,https://sites.google.com/view/deeplaxmievents/home,,,,"Sr no 51, BT Kawade Rd, opposite shirke company"
Kadamb Events,097620 84165,,,,,"435, Moti Chowk, opp. of Railway booking office"
Eventcreatorpune,072628 82622,https://www.instagram.com/eventcreatorpune?igsh=MWN3YzBsdzlrdmtyNw==,,,,"Kakasaheb Shingre Sabhagrah, 524, Tapkir Galli"
Dixita Events,,https://www.instagram.com/invites/contact/?i=1bs7ofzo5kg3s&utm_content=27buluu,,,,·
Krishita Events,092263 65365,https://krishitaevents.com/,,,,
Happy Times Events,,,,,,"Dhanvarsha market, 1149, Dhanvarsha market, 2nd Floor, Govind Halwai Chowk, near Ranka Jewellers"
Bold Marketing,098907 78000,http://boldmarketing.in/,,,,"Lane No. 7, opp. Clover Dale A"
Sphinx Adonis Events International,095884 98571,https://www.sphinxadonisworld.co.in/,,,,"B6/5, 411040 Kubera Park Housing Society Kondhwa Road Lulla Nagar"
SAHAR EVENTS,091755 48974,https://saharevent.in/,,,,"Sphinx House, RH 5&6, S Main Rd"
Event Crafters Pune,,https://www.instagram.com/eventcrafterspune?igsh=MjMwejM4YmJ4MTg2,,,,"6A, Ramabai Ambedkar Rd, behind Pune"
Elite Celebrations - Event Management Company In Pune,,,,,,"7, Koregaon Rd"
SN Event,,http://sn-event.odoo.com/,,,,
Pune Birthday party Decor Magic show Tattoo Artist Game host popcorn Candy Flos papet show Carecacher All Activities,070570 77375,,,,,Lane Number 5
Pooja Balloon decoration camp,,,,,,goan
M S Event Management,,,,,,"511, Centre St"
Taj Events And Production,096733 98719,https://taj-events-and-production.ueniweb.com/?utm_campaign=gmb,,,,Lane No. 7
Ovent | Event Management Company in Pune,074991 91810,,,,,"Plot No 11A, Sector 24, opp. Axis Bank Branch"
Birthday Craft Pune,099231 59521,http://birthdaycraftpune.blogspot.com/,,,,·
Hfshanawaz event,,,,,,"Popular Heights III, Lane D"
Lovedecoration,073918 87977,,,,,411001
STAR EVENTS,084461 03463,,,,,"Sr.no.17, line 7"
Quadri Decorators,098227 99882,,,,,"Shop No, 4, Lane No. 6"
Wonderkraft Events Pune,098602 18819,,,,,"2064, Jan Mohammed Street"
United Group of Services,098331 04763,http://www.uniservices.in/,,,,·
Maniyar Events & Decorations,093710 09092,,,,,"1984/210,Sterling house, near choksi School, Pune M. corporation),, Convent St"
Pushpalata decorators,098501 28595,,,,,"704, Taboot St"
kamblebrothers | the balloon story | birthday decoration | first birthday | theme decoration | event planner,093590 30024,https://kamblebrothers.com/,,,,537 Ganesh Peth m v corner ghasati pool near Kasturi Chowck pune 411042
RedHat Events & Marketing,,,,,,·
SnS Events & Marketing - Top Event Management and Corporate Gifting Solutions in Pune,078880 10102,https://www.snsevents.in/,,,,845
Sai event pune,099224 68859,https://wa.me/919922468859,,,,·
Corporate Event Management Company in Pune - Aayojan Ventures,098238 87070,http://www.aayojanventures.com/,,,,"Deep banglow chowk, 16"
,,,,,,"E/603, Star Gaze"